{"$schema":"https://json-schema.org/draft/2020-12/schema","type":"object","required":["event_id","lrn_id","lrn_version","from_state","to_state","actor","actor_role","reason","evidence_refs","validation_event_refs","timestamp"],"properties":{"event_id":{"type":"string","pattern":"^STATE-[A-Z0-9-]+$"},"lrn_id":{"type":"string"},"lrn_version":{"type":"string","pattern":"^\\d+\\.\\d+\\.\\d+$"},"from_state":{"enum":["proposed","testing","validated","active","suspended","retired"]},"to_state":{"enum":["proposed","testing","validated","active","suspended","retired"]},"actor":{"type":"string"},"actor_role":{"enum":["CREATOR","VALIDATOR","AUDITOR","COUNTER_AUDITOR","PLATFORM"]},"reason":{"type":"string","minLength":1},"evidence_refs":{"type":"array"},"validation_event_refs":{"type":"array"},"timestamp":{"type":"string","format":"date-time"}},"additionalProperties":false}
